tweets, 
"Meet Lieutenant Jack Powers, an incredible American war hero who fought in the Battle of the Coral Sea➡️… https://t.co/nhwEJg73Kq"
Weekly Address - tune in! #MAGA ➡️ https://t.co/XR4jDGqsm0 https://t.co/7R3buX8L72
"#AHCA will help ALL, incl those in IA who will lose coverage if Medica leaves! It's time to fix this broken system!
https://t.co/qHpqEo8WAR"
Watch live as I give remarks commemorating the 75th anniversary of the Battle of the Coral Sea:… https://t.co/6NJ1uIB70H
Thank you @Franklin_Graham. https://t.co/q8I0WUq33B
"Join me along w/ @VP Pence &amp; @BetsyDeVosED at a school choice event in the Roosevelt Room, here at the @WhiteHouse:… https://t.co/lG8s5rcvHw"
"It's an honor to serve as your Commander-in-Chief! Congratulations on winning the Commander-in-Chief's Trophy,… https://t.co/2Aa2NX8U8C"
This month we celebrate the contributions of Asian Americans &amp; Pacific Islanders that enrich our Nation: https://t.co/z4kzN5b4sA
Weekly Address - tune in! #MAGA ➡️ https://t.co/zvXJWoXzgK https://t.co/oq43Kezh0Q
Watch live as I deliver remarks at the @NRA Leadership Forum: https://t.co/rTSv3ZP2D6 https://t.co/aeQmFVLJZq
Watch LIVE from the @DeptVetAffairs as I sign an EO on improving accountability &amp; whistleblower protection:… https://t.co/T3yaSmIOLP
"HAPPY BIRTHDAY to our @FLOTUS, Melania! https://t.co/vyujTfhfI1 https://t.co/FdFRgAmzD9"
"Together, we will make #manufacturing great again! https://t.co/b88RZBag0j"
"Remarks at the United States Holocaust Memorial Museum's National Days of Remembrance. 
Full remarks:… https://t.co/IlFcY15eED"
Congratulations to @SecretarySonny on being confirmed as the 31st @USDA Secretary! -DJT
Thank you @RepRodBlum! https://t.co/ovYAOMSvkr
Join @VP Pence as he makes remarks to our amazing service members at @JointBasePHH. https://t.co/Az2hfiG2Hh
"Today, I signed the Holocaust Remembrance Proclamation. 
#HolocaustRemembranceDay 
Read the proclamation here:… https://t.co/MavODND89s"
Join me in congratulating @NASA's @AstroPeggy by using the hashtag #CongratsPeggy! Earlier today:… https://t.co/9eXX49g96u
"Happy 109th Birthday, @USArmyReserve. Thank you for your service! -DJT https://t.co/yirZwO2j2x"
"Today on Earth Day, we celebrate our beautiful forests, lakes and land. We stand committed to preserving the natural beauty of our nation."
Getting ready to visit Walter Reed Medical Center with Melania. Looking forward to seeing our bravest and greatest Americans!
Weekly Address - tune in! #MAGA ➡️ https://t.co/JkRniO6WOB https://t.co/L2sXQy3yHO
Thank you @usembassyjkt! https://t.co/jXISfY7oaS
"Trump’s “Buy American, Hire American” https://t.co/vmIhXPzCeS"
"We're going to use American steel, we're going to use American labor, we are going to come first in all deals. ➡️ … https://t.co/O6Qv0vlNxF"
#ICYMI- join Prime Minister Paolo Gentiloni and I from the East Room of the White House! https://t.co/7aSedpoY2n
Tune into @NASA TV for coverage of our #Airman headed to #Space! Launch coverage begins @ 2:15 a.m. EST. Watch here… https://t.co/mu8GEbWgp8
"It was my honor, thank you! https://t.co/s0msgZlsYK"
"Today I signed the Veterans (OUR HEROES) Choice Program Extension &amp; Improvement Act @ the @WhiteHouse. #S544 
Watch… https://t.co/cb6f5wTiGB"
#BuyAmericanHireAmerican #MAGA https://t.co/lDSzxKewxN
#MAGA🇺🇸 #VPinASIA https://t.co/bj4WFHI99O
"Despite major outside money, FAKE media support &amp; eleven Republican candidates, BIG ""R"" win with runoff in Georgia. Glad to be of help! -DJT"
"Earlier: Kenosha, Wisconsin- touring @Snapon_Tools w/ @GovWalker, @BetsyDeVosED, @stevenmnuchin1, @SenRonJohnson...… https://t.co/EBPEKC8f42"
Watch live! #BuyAmericanHireAmerican 🇺🇸 ➡️ https://t.co/H6heSYoTU2 https://t.co/R8v8AXmJ9Y
AG Sessions is doing a fantastic job: announced today new steps to dismantle violent gangs like MS-13. I promised to get tough and we are!
Happy Easter to everyone! https://t.co/A3lrwbHdtP
Thank you &amp; congratulations! https://t.co/UD887WqFO9
Weekly Address - tune in! #MAGA ➡️ https://t.co/S5WADLhP6o https://t.co/Kjc4TxwxGV
Welcome home Shane! #USA🇺🇸 https://t.co/jWlg2Sbrow
"Gangs &amp; cartels that flood our country will no longer be able to profit from their lawlessness, turn cities into wa… https://t.co/TDO0kgkcBi"
"North Korea is looking for trouble. If China decides to help, that would be great. If not, we will solve the problem without them!  U.S.A."
Happy Passover to all those celebrating! Chag Sameach! https://t.co/bHVw36z0GX
Congratulations to Justice Neil Gorsuch on his elevation to the United States Supreme Court. A great day for Americ… https://t.co/3kMhiyFKGv
Swearing in of Judge Neil Gorsuch to the #SCOTUS.  https://t.co/fKKDNI13k2
Judge Gorsuch will be sworn in at the Rose Garden of the White House on Monday at 11:00 A.M. He will be a great Justice. Very proud of him!
Weekly Address - tune in! #MAGA ➡️ https://t.co/h5WPg7Qvj3 https://t.co/v9XKovCthr
Congratulations to an exceptionally qualified and respected judge on his confirmation to the Supreme Court! #SCOTUS https://t.co/itTom467MT
Tonight I ordered a targeted military strike...... https://t.co/3nUzrdiGzX
".@FLOTUS &amp; I are honored to welcome the President of the People's Republic of China, Xi Jinping, &amp; Madame Peng Liyu… https://t.co/WsifpJeIK3"
"It was an honor to host our American heroes from the @WWP Solider Ride this morning at the @WhiteHouse w/ @FLOTUS,… https://t.co/Vwlpmvj68s"
Thank you @KingAbdullahII. Melania and I were honored to host you and the Queen at the @WhiteHouse this afternoon! https://t.co/yA2ZDB7Vau
"JOBS, JOBS, JOBS!
https://t.co/blq753IwPR https://t.co/AXInsnXatf"
The historical ties and close friendship between our two countries date back three-quarters of a century..... https://t.co/e2gYFcDuck
Welcome to the @WhiteHouse @KingAbdullahII! https://t.co/N7Yke5QUtm
Great to talk jobs with #NABTU2017. Tremendous spirit &amp; optimism - we will deliver! https://t.co/S5izNOD4mn
"#BuyAmericanHireAmerican🇺🇸
#NABTU2017 https://t.co/sBJnKIRjyN"
Watch live as I deliver remarks at the 2017 NABTU National Legislative Conference: https://t.co/Tvu848FMWU https://t.co/8IjKdQC2is
It was an honor to welcome President Al Sisi of Egypt to the @WhiteHouse as we renew the historic partnership betwe… https://t.co/mc7zVfg6Gz
Looking forward to hosting our heroes from the Wounded Warrior Project (@WWP) Soldier Ride to the @WhiteHouse on Th… https://t.co/rh6mwMlUg7
Congratulations to these amazing @USNavy Submarine Jr. Officers of the Year! https://t.co/Rc8L52lYYx https://t.co/F6gLnvz1g2
".@AP: ""Trump's rollback of coal rules electrifies Wyoming workers""
https://t.co/z5JscUM9XJ"
'Trump Celebrates American Manufacturing Survey Showing Highest Level of Optimism in 20 Years' ➡️… https://t.co/xss8JRYnco
#ConfirmGorsuch #SCOTUS https://t.co/zXPQH5zSfN
"Great meeting with a wonderful woman today, former Secretary of State, Condoleezza Rice! #USA🇺🇸 https://t.co/1bMfa21c5E"
A new surge in optimism is sweeping across our land! #MakeAmericaGreatAgain 🇺🇸 https://t.co/abY0G6CQOZ https://t.co/Qm8nUN1k80
"It was an honor to welcome the Prime Minister of Denmark, Lars Løkke Rasmussen {@larsloekke} to the @WhiteHouse yes… https://t.co/pRWTp4VMwg"
Only by enlisting the full potential of women in our society will we be truly able to #MakeAmericaGreatAgain🇺🇸… https://t.co/SFEUiMFDnr
The meeting next week with China will be a very difficult one in that we can no longer have massive trade....cont➡️https://t.co/dgoliP8yhI
"If @RepMarkMeadows, @Jim_Jordan and @Raul_Labrador would get on board we would have both great healthcare and massive tax cuts &amp; reform."
Great op-ed from @RepKenBuck. Looks like some in the Freedom Caucus are helping me end #Obamacare. https://t.co/c7z1ZKSlbh
Weekly Address - 10:00 A.M. tomorrow! #MAGA ➡️ https://t.co/umsr7N7YHN https://t.co/2kIysOYVCw
#ConfirmGorsuch #SCOTUS https://t.co/k2FiTsHbBf
Congratulations David Friedman! https://t.co/8PGfIybRzZ
".@FLOTUS and I stopped by the Women's Empowerment Panel in the East Room of the @WhiteHouse today. #ICYMI, watch: https://t.co/HKTRfIvPFy"
If the people of our great country could only see how viciously and inaccurately my administration is covered by certain media! -DJT
My action today is the latest in a series of steps to create American jobs and to grow American wealth! #MAGA ➡️… https://t.co/Q82PI9yMTQ
"Tonight I'm proud to sign S. 305, which encourages the display of the U.S. flag on National Vietnam War Veterans Da… https://t.co/yH56XTXjTs"
"A NEW ERA IN AMERICAN ENERGY! 
#MadeInTheUSA🇺🇸
Watch here: https://t.co/cOb8TyTIq6 https://t.co/btBTQBE2Kc"
With the fraternal order of police in the Oval Office - after a great listening session in the Roosevelt Room at th… https://t.co/bfCWNQGNRq
"The failing @NYTimes would do much better if they were honest! 
https://t.co/TWtQcfXfS4"
"I'll keep working with Congress, agencies, and the American people until we eliminate every unnecessary, job-killing regulation we can find!"
"Today I'm signing 4 bills under the Congressional Review Act that cancels regulations &amp; eliminates unnecessary, job… https://t.co/E8Ev8dnPfn"
Thanks you for all of the Trump Rallies today. Amazing support. We will all MAKE AMERICA GREAT AGAIN! https://t.co/qSD1tYUhmP
Thank you @SecretaryPerry &amp; @GregAbbott_TX! #MAGA🇺🇸 https://t.co/CkVRG1Vq7q
ObamaCare will explode and we will all get together and piece together a great healthcare plan for THE PEOPLE. Do not worry!
Weekly Address - 11:00 A.M. today! ➡️https://t.co/CppERgEPBf https://t.co/tDAbRHdAi7
"Today, I was pleased to announce the official approval of the presidential permit for the #KeystonePipeline. A grea… https://t.co/W5j8gdZ6QZ"
"THANK YOU! More conservative groups are endorsing #AHCA. @ACUConservative, @TeaPartyExpress and dozens more! #PassTheBill #RepealANDReplace"
"The irony is that the Freedom Caucus, which is very pro-life and against Planned Parenthood, allows P.P. to continue if they stop this plan!"
"After seven horrible years of ObamaCare (skyrocketing premiums &amp; deductibles, bad healthcare), this is finally your chance for a great plan!"
Disastrous #Obamacare has led to higher costs &amp; fewer options. It will only continue to get worse! We must #RepealANDReplace. #PassTheBill
We must #RepealANDReplace #Obamacare for the millions that are suffering. Tell your Rep you support #AHCA. Locator… https://t.co/If95ybn03H
You were given many lies with #Obamacare! Go with our plan! Call your Rep &amp; let them know you're behind #AHCA ➡️… https://t.co/8J14RnhOVG
I spoke with PM Theresa May of the United Kingdom to offer my condolences on today's terror attack in London....… https://t.co/5FclJUWvr5
#ConfirmGorsuch #SCOTUS https://t.co/EnzFXVMp1M
#ConfirmGorsuch #SCOTUS https://t.co/9dTQDCmh3X
#ConfirmGorsuch #SCOTUS https://t.co/ivDbR6KBKZ
"Honored to sign S.442 today. With this legislation, we support @NASA's scientists, engineers, and astronauts in the… https://t.co/vT6kc10d85"
Joined the @HouseGOP Conference this morning at the U.S. Capitol. https://t.co/5kRYOAIaCY #PassTheBill #MAGA🇺🇸… https://t.co/XH0BkfAcIK
Judge Gorsuch is the kind of judge we need on #SCOTUS - someone with a brilliant legal mind &amp; a commitment to const… https://t.co/xBrIfE4zi3
"FBI Director Comey: fmr. DNI Clapper ""right"" to say no evidence of collusion between Russia and Trump Campaign.… https://t.co/nUMYPlJQdd"
FBI Director Comey admits Obama’s White House had ability to “unmask” American citizens. https://t.co/gIo6it9NcQ
FBI Director Comey says classified leaks to the media have been “unusually active” recently. https://t.co/WumDJSqaFA
NSA Director Rogers tells Congress unmasking individuals endangers national security. https://t.co/jTwjPINvNh
The NSA and FBI tell Congress that Russia did not influence electoral process. https://t.co/d9HqkxYBt5
FBI Director Comey refuses to deny he briefed President Obama on calls made by Michael Flynn to Russia. https://t.co/cUZ5KgBSYP
"...vast sums of money to NATO &amp; the United States must be paid more for the powerful, and very expensive, defense it provides to Germany!"
"Despite what you have heard from the FAKE NEWS, I had a GREAT meeting with German Chancellor Angela Merkel. Nevertheless, Germany owes..."
"It's time to put #AmericaFirst when it comes to how we spend taxpayers' money. We will keep our people safe! 
https://t.co/A0tlzHutF8"
Weekly Address - 11:00 A.M. tomorrow! #MAGA 🇺🇸 ➡️ https://t.co/ztQkg5Niwv https://t.co/P7n7b8T2cD
Great meeting with the @RepublicanStudy Committee this morning at the @WhiteHouse! https://t.co/U8gaHBVmW7
Attending a great listening session with @DeptVetAffairs @SecShulkin in the Roosevelt Room. We are going to take ca… https://t.co/yThFvucOcy
"North Korea is behaving very badly. They have been ""playing"" the United States for years. China has done little to help!"
Happy Lá Fheile Phadraig to all of my great Irish friends!
My representatives had a great meeting w/ the Hispanic Chamber of Commerce at the WH today. Look forward to tremendous growth &amp; future mtgs!
Great progress on healthcare. Improvements being made - Republicans coming together!
We will rebuild our MILITARY. We will keep our people SAFE. We will take care of our VETS. We will put #AmericaFirst https://t.co/A0tlzHutF8
"Congratulations @SenDanCoats!
#MakeAmericaGreatAgain🇺🇸 https://t.co/b3KjESNdyG"
A budget that puts #AmericaFirst must make safety its no. 1 priority—without safety there can be no prosperity: https://t.co/A0tlzHutF8
Andrew Jackson: We thank you for your service. We honor your memory. We build on your legacy &amp; we thank God for the… https://t.co/D3hXIYeutZ
I will be interviewed by @TuckerCarlson tonight at 9:00 P.M. on @FoxNews. Enjoy!
#MakeAmericaGreatAgain ➡️ https://t.co/R12kH3S6Ap https://t.co/wGnKwFgceJ
#BuyAmericanHireAmerican: it's a pledge! https://t.co/93VihEM5Yn
"""We are not simply here to honor the past, but to devote ourselves to a new future of American Automotive Leadershi… https://t.co/YAxFmNMYc8"
Join me LIVE as I deliver remarks at the American Center for Mobility ➡️ https://t.co/R12kH3S6Ap https://t.co/rQgH8Xw3n1
CEO's most optimistic since 2009. It will only get better as we continue to slash unnecessary regulations and when we begin our big tax cut!
"Will be going to Detroit, Michigan (love), today for a big meeting on bringing back car production to State &amp; U.S. Already happening!"
"Can you imagine what the outcry would be if @SnoopDogg, failing career and all, had aimed and fired the gun at President Obama? Jail time!"
Congratulations Seema! https://t.co/abG2Wc5I0H
Great optimism in America – and the results will be even better! https://t.co/TwsySB06ac
"JOBS, JOBS, JOBS! https://t.co/FUwemhEaDK"
#Obamacare has led to📈costs &amp; fewer📉health insurance options for millions of Americans. How has it impacted you? ➡️… https://t.co/lphGtjak4Y
"Meeting w/ Washington, D.C. @MayorBowser and Metro GM Paul Wiedefeld about incoming winter storm preparations here… https://t.co/NaadHfk7eB"
"If Obamacare is so great, why'd they spend tens of millions of taxpayer dollars to 'hype' it? BAD! #RepealAndReplace https://t.co/5mur5pIFQz"
Proud to welcome our great Cabinet members to the @WhiteHouse this afternoon with @VP Pence. https://t.co/nwnSqk8wST
Everyone along the east coast be safe and listen to local officials as a major winter storm approaches. @NWS… https://t.co/2OUG6NMuSe
Healthcare listening session w/ @VP &amp; @SecPriceMD. Watch: https://t.co/RO5aXJLadw #ReadTheBill:… https://t.co/MTwusn80GT
#RepealAndReplace #Obamacare https://t.co/RO5aXJLadw https://t.co/SLuVWiU1cN
"ObamaCare is imploding. It is a disaster and 2017 will be the worst year yet, by far! Republicans will come together and save the day."
"It is amazing how rude much of the media is to my very hard working representatives. Be nice, you will do much better!"
#MakeAmericaGreatAgain🇺🇸 https://t.co/hDtpbl4oA9
We are making great progress with healthcare. ObamaCare is imploding and will only get worse. Republicans coming together to get job done!
"#ICYMI- Weekly Address:
https://t.co/EMAjO07GuJ https://t.co/ZqPAERhu8C"
#ReadTheBill: https://t.co/jb8Yoyftyz https://t.co/d9kVtHW1bk
"Three-Pronged Approach to REPEAL AND REPLACE #Obamacare! 
➡️https://t.co/XCYPOc0bzi https://t.co/vSLVJ6KXao"
We are taking steps to stabilize health insurance markets and start bringing down costs for MILLIONS of people affected by #Obamacare.
Great meeting w/ the healthcare specific House Committee Leadership this afternoon at the @WhiteHouse. #ReadTheBill… https://t.co/yDofamvQ8r
Join @PressSec live- coming up soon! https://t.co/EOpAFnlG7W
"Weekly Address - 11:00 A.M. at the @WhiteHouse! #MAGA🇺🇸
➡️https://t.co/EMAjO07GuJ https://t.co/RjOook4k0I"
Honored to meet this years @SenateYouth delegates w/ @VP Pence in the East Room of the @WhiteHouse. Congratulations… https://t.co/NuZIDEJlLm
Great legislative affairs meeting this afternoon at the @WhiteHouse. https://t.co/Pu3cx6Jj2E
Join @PressSec at https://t.co/9OsPtLVgfw for today's briefing!
Great listening session with CEOs of community banks today at the @WhiteHouse! https://t.co/kQ8p2Y6nBV https://t.co/TyNGFWSpiM
"Despite what you hear in the press, healthcare is coming along great. We are talking to many groups and it will end in a beautiful picture!"
"Great news. We are only just beginning. Together, we are going to #MAGA! https://t.co/4QayxcKjoR https://t.co/fOuQkzzgRH"
Met with @RepCummings today at the @WhiteHouse. Great discussion!
"#RepealAndReplace #Obamacare
https://t.co/co5mMBv7Aa"
U.S. private sector job creation surging with nearly 300K created last month. Much more than expected! https://t.co/XYf0Sc4eqG
"On International Women's Day, join me in honoring the critical role of women here in America &amp; around the world. https://t.co/eAbd9OiUl5"
I have tremendous respect for women and the many roles they serve that are vital to the fabric of our society and our economy.
I feel sure that my friend @RandPaul will come along with the new and great health care program because he knows Obamacare is a disaster!
#ConfirmGorsuch #SCOTUS https://t.co/cst1KtlUcY
"Don't let the FAKE NEWS tell you that there is big infighting in the Trump Admin. We are getting along great, and getting major things done!"
"A new chapter of AMERICAN GREATNESS is now beginning. Together, we will MAKE AMERICA GREAT AGAIN!… https://t.co/NSbJ6N93GM"
Our wonderful new Healthcare Bill is now out for review and negotiation. #ObamaCare is a complete and total disaster - is imploding fast!
"122 vicious prisoners, released by the Obama Administration from Gitmo, have returned to the battlefield. Just another terrible decision!"
"House just introduced the bill to #RepealAndReplace #Obamacare. Time to end this nightmare. 
https://t.co/z4A27JwaXX"
"There is an incredible spirit of optimism sweeping the country right now—we're bringing back the JOBS!
Watch:… https://t.co/srsZd8owBa"
#ICYMI- join me on the soon to be commissioned #USSGeraldRFord. You can watch here: https://t.co/MTMfLbed3q https://t.co/H64lSJ8Wuq
MAKE AMERICA GREAT AGAIN! https://t.co/O08AlsWQzu
"I hereby demand a second investigation, after Schumer, of Pelosi for her close ties to Russia, and lying about it. https://t.co/ZLTxCuY9qU"
"Watch my Weekly Address: 

https://t.co/VqJZUBUJpr

Enjoy! https://t.co/6KA9Zr7IHs"
Jeff Sessions is an honest man. He did not say anything wrong. He could have stated his....https://t.co/woEQgNejjK
"Congratulations to our new Secretary of @ENERGY, Rick Perry! https://t.co/gt7VWGrmu7"
"Congratulations to our new Secretary of @HUDgov, Dr. Ben Carson! https://t.co/VhwZWxoxV3"
"Congratulations to our new Secretary of @Interior, Ryan Zinke! https://t.co/j4Tqcl5hmQ"
"THANK YOU!
https://t.co/3MKdgMsNIM"
A new chapter of American Greatness is now beginning. #AmericanSpirit
I am asking all citizens to embrace this Renewal of the #AmericanSpirit. #JointAddress
"We are one people, with one destiny.

We all bleed the same blood.

We all salute the same flag.

And we are all made by the same God."
Think of the marvels we can achieve if we simply set free the dreams of our people. #AmericanSpirit #JointAddress
"We want harmony and stability, not war and conflict. We want peace, wherever peace can be found. #JointAddress #AmericanSpirit"
Ryan’s legacy is etched into eternity. #AmericanSpirit
My budget will increase funding for our Veterans. Our Veterans have delivered for this nation. Now we MUST deliver for them. #JointAddress
We must provide the men and women of the U.S. Military with the tools they need to prevent war and – if they must – TO FIGHT AND TO WIN.
We must support the incredible men and women of law enforcement. #JointAddress #AmericanSpirit
"EVERY American child should be able to grow up in a safe community, to attend a great school, and to have access to a high-paying job."
Education is the civil rights issue of our time. I am calling for an education bill that funds school choice for disadvantaged youth.
The time has come to give Americans the freedom to purchase health insurance across state lines! #JointAddress
We must ensure that Americans with pre-existing conditions have access to coverage. #JointAddress
"Obamacare is collapsing – and we must act decisively to protect all Americans. Action is not a choice, it is a necessity. #JointAddress"
"I am calling on Congress to REPEAL &amp; REPLACE OBAMACARE with reforms that expand choice, increase access, lower costs &amp; provide better care."
"The time has come for a new program of national rebuilding that will be guided by two core principles: Buy American, and Hire American!"
"I believe in free trade, but it also must be FAIR TRADE. I'm not going to let our great companies and workers be taken advantage of anymore!"
My team is developing historic tax reform that will reduce the tax rate on our companies &amp; provide massive tax relief for the middle class.
"We must restart the engine of the American economy, making it easier for companies to do business in the US &amp; much harder for them to leave!"
Solving these problems will require us to tap into the #AmericanSpirit that has overcome every challenge throughout our storied history.
"In the last 8 years, the past Administration has put on more new debt than nearly all other Presidents combined. #JointAddress"
"It is not compassionate, but reckless, to allow uncontrolled entry from places where proper vetting cannot occur. #JointAddress"
"As we speak, we are removing gang members, drug dealers and criminals that threaten our communities and prey on our citizens. #JointAddress"
My Administration has answered the pleas of the American people for immigration enforcement and border security. #JointAddress
"We will stop the drugs from pouring into our country &amp; poisoning our youth, and we will expand treatment for those who have become addicted."
I have issued a new directive that American pipelines must be made with American steel. #JointAddress #AmericanSpirit
"Above all else, we will keep our promises to the American People. #JointAddress #AmericanSpirit"
"America must put its own citizens first, because only then can we truly Make America Great Again! #JointAddress #AmericanSpirit"
A surge of optimism is placing impossible dreams firmly within our grasp. What we are witnessing today is the Renewal of the #AmericanSpirit
"I am here tonight to deliver a message of unity and strength, and it is a message deeply delivered from my heart. #JointAddress"
We are a country that stands united in condemning hate and evil in all of its very ugly forms. #JointAddress
"#JointSession #MAGA
https://t.co/DcUUhLyFRU"
I will be interviewed on @foxandfriends at 6:00 A.M. Enjoy!
Thank you to the great presidents of our #HBCUs for their commitment to higher education. Read more here:… https://t.co/2qS4FgnCe2
"Congratulations to our new Secretary of @CommerceGov, Wilbur Ross! https://t.co/pMmlLRzwky"
Great meeting with CEOs of leading U.S. health insurance companies who provide great healthcare to the American peo… https://t.co/xpgnT28EOY
#Obamacare has failed. We are going to #RepealAndReplace! https://t.co/4jusbJ9qLc
"Big dinner with Governors tonight at White House. Much to be discussed, including healthcare."
"Russia talk is FAKE NEWS put out by the Dems, and played up by the media, in order to mask the big election defeat and the illegal leaks!"
I will not be attending the White House Correspondents' Association Dinner this year. Please wish everyone well and have a great evening!
Weekly Address from @WhiteHouse: ➡️https://t.co/7PgkrtM0OY https://t.co/O43Y05vaQV
"Thank you #CPAC2017! 
https://t.co/H66racvGwR https://t.co/TbegxBj6uY"
This afternoon I signed an executive order to establish task forces that will help scrap job-killing regulations on… https://t.co/ImrztJhExu
"One by one, we are checking off the promises we made to the people of the United States....cont: https://t.co/3toujY1nLk"
We inherited a national debt that has doubled in eight years. We inherited a foreign policy marked by one....cont: https://t.co/r0koJ91b4Q
"We are also putting in a massive budget request for the military, and we will be substantially upgrading....cont:… https://t.co/USPslAsBvH"
"We are going to massively lower taxes on the middle class, reduce taxes on American business, and make our....cont: https://t.co/IdDBsvYynT"
